<!ELEMENT date (day,month,year?)>
<!ELEMENT day (#PCDATA)>
<!ELEMENT month (#PCDATA)>
<!ELEMENT year (#PCDATA)>

<!ELEMENT a (date*)>
<!ELEMENT b (#PCDATA)>
<!ELEMENT c (b+ | (b?, a)*)>